{
  "schema_version": 2,
  "name": "Night shift - continuous slide study",
  "revision": 1,
  "tempo_bpm": 96,
  "length_beats": 8,
  "seed": 42,
  "instrument": {
    "model": "contact_0_2",
    "tuning_midi": [64, 59, 55, 50, 45, 40],
    "decay_seconds": 4,
    "brightness": 0.78,
    "body_mix": 0.15
  },
  "events": [
    {"id":"study-p1", "type":"pluck", "beat":0, "string":6, "fret":0, "strength":0.72},
    {"id":"study-p2", "type":"pluck", "beat":0.75, "string":5, "fret":2, "strength":0.5},
    {"id":"study-p3", "type":"pluck", "beat":2, "string":4, "fret":0, "strength":0.55},
    {"id":"study-b1", "type":"body_hit", "beat":3, "strength":0.28},
    {"id":"study-p4", "type":"pluck", "beat":4, "string":6, "fret":3, "strength":0.68},
    {"id":"study-p5", "type":"pluck", "beat":5, "string":2, "fret":3, "strength":0.5},
    {"id":"study-p6", "type":"pluck", "beat":6, "string":3, "fret":0, "strength":0.5},
    {"id":"study-d1", "type":"damp", "beat":7.5, "string":6, "strength":0.8}
  ],
  "gestures": [
    {"id":"study-s1", "type":"slide", "beat":0.2, "string":6, "points":[
      {"beat":0, "fret":0}, {"beat":0.435, "fret":2.25}, {"beat":1.3, "fret":7}
    ]},
    {"id":"study-s2", "type":"slide", "beat":2, "string":4, "points":[
      {"beat":0, "fret":0}, {"beat":0.33, "fret":1.5}, {"beat":1.25, "fret":5}
    ]},
    {"id":"study-s3", "type":"slide", "beat":4.25, "string":6, "points":[
      {"beat":0, "fret":3}, {"beat":0.6, "fret":2.5}, {"beat":1.5, "fret":1}
    ]},
    {"id":"study-s4", "type":"slide", "beat":6.125, "string":3, "points":[
      {"beat":0, "fret":0}, {"beat":0.375, "fret":2.5}, {"beat":1, "fret":4}
    ]}
  ]
}
